nct_id,title,phase,status,study_type,conditions,interventions,molecular_targets,sponsor,collaborators,enrollment_count,start_date,completion_date,locations,needs_review,source_url
NCT06807619,BrainMet ADePPT (Anticancer Drug Penetration Platform Trial),Phase 1,Recruiting,Interventional,Brain Tumor,Sotorasib,,Memorial Sloan Kettering Cancer Center,Amgen,16,2025-01-29,2028-01-05,United States,No,https://clinicaltrials.gov/study/NCT06807619
NCT06874790,"Randomized Controlled Trial of a Choice-driven, Interactive, Storytelling Web-based App to Investigate Mental Health Treatment Initiation Among Symptomatic Latinas",Not Applicable,Recruiting,Interventional,"Mental Health; Anxiety; Depression; Well-Being, Psychological",Catalina; Control webpage,,"University of California, Los Angeles",National Institute of Mental Health (NIMH),700,2025-07-09,2028-11-30,United States,No,https://clinicaltrials.gov/study/NCT06874790
NCT06875310,"A Randomized, Double-Blind, Phase 3 Trial of Adagrasib Plus Pembrolizumab Plus Chemotherapy vs. Placebo Plus Pembrolizumab Plus Chemotherapy in Participants With Previously Untreated, Locally Advanced or Metastatic Non-squamous Non-small Cell Lung Cancer With KRAS G12C Mutation (KRYSTAL-4)",Phase 3,Recruiting,Interventional,"Carcinoma, Non-Small-Cell Lung",Adagrasib; Pembrolizumab; Carboplatin; Pemetrexed; Placebo; Cisplatin,,Mirati Therapeutics Inc.,,630,2025-04-24,2032-04-30,Argentina; Australia; Austria; Belgium; Brazil; Bulgaria; Canada; Chile; China; Colombia; Croatia; France; Germany; Greece; Hong Kong; Hungary; India; Ireland; Israel; Italy; Japan; Mexico; Netherlands; Poland; Portugal; Romania; Saudi Arabia; South Korea; Spain; Switzerland; Taiwan; Thailand; Turkey (Türkiye); United Kingdom; United States,No,https://clinicaltrials.gov/study/NCT06875310
NCT06876363,"A Phase 1/2 Open-Label, Single-Ascending-Dose Study of EN-374, a Helper-Dependent Adenoviral-Based Gene Therapy, in Participants With X-Linked Chronic Granulomatous Disease",Phase 1/Phase 2,Recruiting,Interventional,X-Linked Chronic Granulomatous Disease,EN-374,,Ensoma,,15,2025-08-05,2027-12-05,United States,No,https://clinicaltrials.gov/study/NCT06876363
NCT06881784,"RASolve 301: Phase 3 Multicenter, Open Label, Randomized Study of RMC-6236 Versus Docetaxel in Patients With Previously Treated Locally Advanced or Metastatic RAS[MUT] NSCLC",Phase 3,Recruiting,Interventional,NSCLC (Non-small Cell Lung Cancer); Non-Small Cell Lung Cancer; NSCLC; NSCLC (Non-small Cell Lung Carcinoma); NSCLC (Advanced Non-small Cell Lung Cancer),daraxonrasib; docetaxel,,"Revolution Medicines, Inc.",,420,2025-05-06,2030-12-01,Australia; Belgium; France; Germany; Hong Kong; Ireland; Italy; Japan; Netherlands; Poland; Puerto Rico; Singapore; South Korea; Spain; Switzerland; Taiwan; United States,No,https://clinicaltrials.gov/study/NCT06881784
NCT06890598,"A Phase 3, Multicenter, Double-Blind, Placebo-controlled Study Assessing the Efficacy and Safety of Olomorasib in Combination With Standard of Care Immunotherapy in Participants With Resected or Unresectable KRAS G12C-Mutant, Non-Small Cell Lung Cancer - SUNRAY-02",Phase 3,Recruiting,Interventional,"Carcinoma, Non-Small-Cell Lung",Olomorasib; Pembrolizumab; Durvalumab; Placebo,,Eli Lilly and Company,AstraZeneca,700,2025-03-27,2032-02-05,Australia; Austria; Belgium; Brazil; Chile; China; Czechia; France; Germany; Greece; Hungary; India; Israel; Italy; Japan; Netherlands; Norway; Poland; Portugal; Romania; Slovakia; South Korea; Spain; Sweden; Switzerland; Taiwan; Turkey (Türkiye); United Kingdom; United States,No,https://clinicaltrials.gov/study/NCT06890598
NCT06896162,PROGRESS: Precision Oncology Using Genomic Reflexive Evaluations for Study Selection and Survival,Not Applicable,Recruiting,Interventional,Solid Tumor Malignancies; Metastatic Cancer; Breast Cancer; Colorectal Cancer; Lung Cancer; Bladder Cancer,Expert Review; Blood or tissue samples collection.; The Precision Oncology Navigation,,UNC Lineberger Comprehensive Cancer Center,Eli Lilly and Company,500,2025-06-27,2028-06-05,United States,No,https://clinicaltrials.gov/study/NCT06896162
NCT06914726,Randomized Trial to Improve Care of Patients With Hereditary Cancer Syndromes,Not Applicable,Enrolling by invitation,Interventional,"Hereditary Breast/Ovarian Cancer (brca1, brca2); Lynch Syndrome; Genetic Variation; HBOC Syndrome; Hereditary Cancer Syndromes",Patient Centered Clinical Decision Support (PC-CDS),,HealthPartners Institute,National Cancer Institute (NCI),2488,2025-07-09,2029-03-31,United States,No,https://clinicaltrials.gov/study/NCT06914726
NCT06917079,"A Phase 1a/1b Open-Label Study Evaluating the Safety, Tolerability, Pharmacokinetics, and Efficacy of BBO-11818 in Subjects With Advanced KRAS Mutant Cancers",Phase 1,Recruiting,Interventional,"Non-Small Cell Lung Cancer; NSCLC; PDAC - Pancreatic Ductal Adenocarcinoma; CRC (Colorectal Cancer); Metastatic Non-Small Lung Cell Cancer; Metastatic Colorectal Cancer (CRC); KRAS G12A; KRAS G12C; KRAS G12D; KRAS G12S; KRAS G12V; Metastatic Pancreatic Ductal Adenocarcinoma; Advanced Lung Carcinoma; Solid Tumor, Adult",BBO-11818; Pembrolizumab; Platinum chemotherapy (cisplatin or carboplatin); Pemetrexed; Cetuximab,,"TheRas, Inc., d/b/a BBOT (BridgeBio Oncology Therapeutics)",,287,2025-03-31,2029-09-05,United States,No,https://clinicaltrials.gov/study/NCT06917079
NCT06964633,The Ku Ola Project,Not Applicable,Not yet recruiting,Interventional,Health Promotion; Health,Kūkākūkā Discussion Sessions,,University of Hawaii,,600,2025-11-01,2026-05-31,United States,No,https://clinicaltrials.gov/study/NCT06964633
NCT06972667,Interventions to Decrease Cancer Information Avoidance,Not Applicable,Not yet recruiting,Interventional,Health Information Avoidance,Video to promote colonoscopy; Video to promote screening for colorectal cancer with home tests,,State University of New York at Buffalo,National Cancer Institute (NCI),1500,2025-10-05,2026-09-05,United States,No,https://clinicaltrials.gov/study/NCT06972667
